{
  "asset_path": "/Game/BP_Test",
  "graph_id": "EventGraph",
  "graph_type": "BlueprintEventGraph",
  "schema_version": "1.0",
  "content_hash": "sha256:deadbeef",
  "revision": "sha256:deadbeef",
  "retrieved_at": "2026-07-29T00:00:00Z",
  "nodes": [
    {
      "node_id": "guid-aaaa",
      "semantic_id": "event.begin_play",
      "node_class": "K2Node_Event",
      "semantic_type": "event_begin_play",
      "title": "BeginPlay",
      "position": [
        100,
        200
      ],
      "properties": {
        "bOverrideFunction": true
      },
      "input_pins": [],
      "output_pins": [
        {
          "pin_id": "pin-guid-1",
          "name": "then",
          "direction": "output",
          "pin_type": {
            "category": "exec"
          },
          "default_value": null,
          "links": [
            {
              "node_id": "guid-bbbb",
              "pin_id": "pin-guid-2"
            }
          ]
        }
      ]
    },
    {
      "node_id": "guid-bbbb",
      "semantic_id": "print_string",
      "node_class": "K2Node_CallFunction",
      "semantic_type": "call_function",
      "title": "Print String",
      "position": [
        400,
        200
      ],
      "properties": {
        "FunctionReference": "PrintString"
      },
      "input_pins": [
        {
          "pin_id": "pin-guid-2",
          "name": "execute",
          "direction": "input",
          "pin_type": {
            "category": "exec"
          },
          "links": [
            {
              "node_id": "guid-aaaa",
              "pin_id": "pin-guid-1"
            }
          ]
        },
        {
          "pin_id": "pin-guid-3",
          "name": "InString",
          "direction": "input",
          "pin_type": {
            "category": "string"
          },
          "default_value": "hello",
          "links": []
        }
      ],
      "output_pins": []
    }
  ],
  "links": [
    {
      "from_node": "guid-aaaa",
      "from_pin": "pin-guid-1",
      "to_node": "guid-bbbb",
      "to_pin": "pin-guid-2",
      "kind": "exec"
    }
  ]
}
